{
  "$schema": "http://json-schema.org/draft-07/schema#",
  "$id": "https://slettix-analytics/schemas/data-product/v1.json",
  "title": "DataProductManifest",
  "description": "Schema for a Slettix Analytics data product manifest",
  "type": "object",
  "required": [
    "id",
    "name",
    "domain",
    "owner",
    "version",
    "description",
    "source_path",
    "format"
  ],
  "additionalProperties": false,
  "properties": {
    "id": {
      "type": "string",
      "pattern": "^[a-z0-9_]+\\.[a-z0-9_]+$",
      "description": "Unique product identifier on the form <domain>.<product> (e.g. hr.employees)"
    },
    "name": {
      "type": "string",
      "description": "Human-readable product name"
    },
    "domain": {
      "type": "string",
      "pattern": "^[a-z0-9_]+$",
      "description": "Owning domain (e.g. hr, finance, sales)"
    },
    "owner": {
      "type": "string",
      "description": "Team or person responsible for this product"
    },
    "version": {
      "type": "string",
      "pattern": "^\\d+\\.\\d+\\.\\d+$",
      "description": "Semantic version (MAJOR.MINOR.PATCH)"
    },
    "description": {
      "type": "string",
      "description": "What the product contains and when it should be used"
    },
    "source_path": {
      "type": "string",
      "description": "S3/MinIO path to the underlying data (s3://...)"
    },
    "format": {
      "type": "string",
      "enum": [
        "delta",
        "parquet",
        "csv"
      ],
      "description": "Storage format of the data product"
    },
    "primary_key": {
      "type": "string",
      "description": "Primary key column name (used for deduplication and merge)"
    },
    "dag_id": {
      "type": "string",
      "description": "Airflow DAG ID that produces this product"
    },
    "quality_sla": {
      "type": "object",
      "description": "Data quality and freshness requirements",
      "properties": {
        "max_null_rate": {
          "type": "number",
          "minimum": 0,
          "maximum": 1,
          "description": "Maximum allowed fraction of null values (0 = no nulls allowed)"
        },
        "freshness_hours": {
          "type": "integer",
          "minimum": 1,
          "description": "Maximum allowed age of data in hours before SLA is breached"
        }
      },
      "additionalProperties": false
    },
    "access": {
      "type": "string",
      "enum": [
        "public",
        "restricted"
      ],
      "default": "public",
      "description": "Visibility: public = anyone, restricted = requires API key"
    },
    "product_type": {
      "type": "string",
      "enum": [
        "source",
        "analytical"
      ],
      "default": "source",
      "description": "source = platform pipeline product, analytical = consumer-created composition"
    },
    "source_products": {
      "type": "array",
      "items": {
        "type": "string"
      },
      "description": "Product IDs this analytical product is built on (e.g. [\"hr.employees\"])"
    },
    "tags": {
      "type": "array",
      "items": {
        "type": "string"
      },
      "description": "Free-form tags for search and filtering"
    },
    "schema": {
      "type": "array",
      "description": "Delta table schema (auto-injected by publish.py)",
      "items": {
        "type": "object",
        "properties": {
          "name": {
            "type": "string"
          },
          "type": {
            "type": "string"
          },
          "nullable": {
            "type": "boolean"
          },
          "description": {
            "type": "string"
          },
          "pii": {
            "type": "boolean",
            "description": "Marker kolonnen som personopplysning (PII)"
          },
          "sensitivity": {
            "type": "string",
            "enum": ["low", "medium", "high"],
            "description": "Sensitivitetsnivå for kolonnen"
          }
        },
        "required": [
          "name",
          "type"
        ],
        "additionalProperties": false
      }
    },
    "column_lineage": {
      "type": "array",
      "description": "Column-level lineage — how each output column is derived from source columns",
      "items": {
        "type": "object",
        "properties": {
          "column": {
            "type": "string",
            "description": "Output column name in this product"
          },
          "sources": {
            "type": "array",
            "description": "Source columns this output column is derived from",
            "items": {
              "type": "object",
              "properties": {
                "product_id": {
                  "type": "string",
                  "description": "Source product ID (e.g. hr.employees)"
                },
                "column": {
                  "type": "string",
                  "description": "Source column name"
                }
              },
              "required": ["column"],
              "additionalProperties": false
            }
          },
          "description": {
            "type": "string",
            "description": "Optional description of the transformation"
          },
          "transformation": {
            "type": "string",
            "description": "Alias for description — human-readable transformation logic"
          }
        },
        "required": ["column", "sources"],
        "additionalProperties": false
      }
    },
    "retention": {
      "type": "object",
      "description": "Dataretensjons-policy for dette produktet",
      "properties": {
        "days": {
          "type": "integer",
          "minimum": 1,
          "description": "Antall dager data skal beholdes"
        },
        "strategy": {
          "type": "string",
          "enum": ["delete", "archive"],
          "default": "delete",
          "description": "Hva som skjer med gammel data: slett eller arkiver"
        },
        "partition_column": {
          "type": "string",
          "description": "Kolonnen som brukes for partisjonsbasert sletting (f.eks. event_date)"
        }
      },
      "additionalProperties": false
    },
    "contract": {
      "type": "object",
      "description": "Formell datakontakt mellom produsent og konsument",
      "properties": {
        "slo": {
          "type": "object",
          "description": "Service Level Objectives",
          "properties": {
            "freshness_hours": {
              "type": "integer",
              "minimum": 1,
              "description": "Maksimal alder på data i timer"
            },
            "completeness_pct": {
              "type": "number",
              "minimum": 0,
              "maximum": 100,
              "description": "Minimum andel ikke-null verdier i prosent"
            }
          },
          "additionalProperties": false
        },
        "schema_compatibility": {
          "type": "string",
          "enum": ["BACKWARD", "FORWARD", "FULL", "NONE"],
          "default": "NONE",
          "description": "Schema-kompatibilitetsregel for nye versjoner"
        },
        "guaranteed_columns": {
          "type": "array",
          "items": {"type": "string"},
          "description": "Kolonner produsenten garanterer alltid vil finnes"
        },
        "deprecation": {
          "type": "object",
          "properties": {
            "sunset_date": {
              "type": "string",
              "description": "Dato produktet avvikles (YYYY-MM-DD)"
            },
            "successor": {
              "type": "string",
              "description": "Produkt-ID som erstatter dette produktet"
            }
          },
          "additionalProperties": false
        }
      },
      "additionalProperties": false
    }
  }
}
